dateTime|severity|header|message
2020-03-24T04:22:49-07:00|warning|Duis dignissim tempor arcu. Vestibulum|Integer vitae nibh. Donec est mauris, rhoncus id, mollis nec, cursus a, enim. Suspendisse aliquet, sem ut cursus luctus, ipsum
2019-01-23T23:53:52-08:00|error|tellus sem mollis dui, in sodales elit|Pellentesque ut ipsum ac mi eleifend egestas. Sed pharetra, felis eget varius ultrices, mauris ipsum porta elit, a feugiat tellus lorem eu metus. In lorem.
2019-09-06T05:43:19-07:00|warning|dictum sapien. Aenean massa. Integer vitae|dolor. Quisque tincidunt pede ac urna. Ut tincidunt vehicula risus. Nulla eget metus eu erat semper rutrum. Fusce dolor quam, elementum at, egestas a, scelerisque sed, sapien. Nunc pulvinar arcu et pede.
2018-06-07T04:35:22-07:00|warning|elit. Curabitur sed tortor. Integer aliquam adipiscing lacus. Ut nec urna et arcu imperdiet ullamcorper.|vitae aliquam eros turpis non enim. Mauris quis turpis vitae purus gravida sagittis. Duis gravida. Praesent eu nulla at sem molestie sodales. Mauris blandit enim consequat purus. Maecenas libero est, congue a, aliquet vel, vulputate eu, odio. Phasellus at augue id ante dictum cursus. Nunc mauris elit,
2019-11-17T09:58:45-08:00|error|posuere cubilia Curae; Donec tincidunt. Donec vitae erat vel pede blandit|bibendum ullamcorper. Duis cursus, diam at pretium aliquet, metus urna convallis erat, eget tincidunt dui augue eu tellus. Phasellus elit pede, malesuada vel, venenatis vel, faucibus id, libero. Donec consectetuer mauris id sapien. Cras dolor dolor, tempus non,
2018-12-02T18:22:31-08:00|info|mus. Aenean eget magna. Suspendisse tristique neque venenatis lacus. Etiam bibendum fermentum metus. Aenean sed pede nec ante blandit viverra.|nec ante blandit viverra. Donec tempus, lorem fringilla ornare placerat, orci lacus vestibulum lorem, sit amet ultricies sem magna nec quam. Curabitur vel lectus. Cum sociis natoque penatibus et magnis dis parturient montes, nascetur ridiculus mus. Donec dignissim magna a tortor. Nunc commodo auctor velit.
2019-09-08T20:25:50-07:00|warning|Sed nulla ante, iaculis nec, eleifend non, dapibus rutrum, justo. Praesent luctus. Curabitur egestas nunc sed libero. Proin sed|quis, pede. Suspendisse dui. Fusce diam nunc, ullamcorper eu, euismod ac, fermentum vel, mauris. Integer sem elit, pharetra ut, pharetra sed, hendrerit a, arcu. Sed et
2018-11-16T12:37:46-08:00|error|ante. Maecenas mi felis, adipiscing fringilla, porttitor vulputate,|non, bibendum sed, est. Nunc laoreet lectus quis massa. Mauris vestibulum, neque sed dictum eleifend, nunc risus varius orci, in consequat enim diam vel arcu. Curabitur ut odio vel est tempor bibendum. Donec felis orci, adipiscing non, luctus sit amet,
2020-01-26T15:29:31-08:00|info|magnis dis parturient montes, nascetur ridiculus mus. Proin vel arcu eu odio tristique pharetra.|eu turpis. Nulla aliquet. Proin velit. Sed malesuada augue ut lacus. Nulla tincidunt, neque vitae semper egestas, urna justo faucibus lectus, a sollicitudin
2020-03-30T19:05:05-07:00|error|sodales. Mauris blandit enim consequat purus. Maecenas libero est, congue a, aliquet vel,|nec orci. Donec nibh. Quisque nonummy ipsum non arcu. Vivamus sit amet risus. Donec egestas. Aliquam nec enim. Nunc ut erat.
2019-01-31T17:31:43-08:00|info|aliquet molestie tellus. Aenean egestas hendrerit|augue. Sed molestie. Sed id risus quis diam luctus lobortis. Class aptent taciti sociosqu ad litora torquent per conubia nostra, per inceptos hymenaeos. Mauris ut quam vel sapien imperdiet ornare. In faucibus. Morbi vehicula. Pellentesque tincidunt tempus
2019-05-14T23:49:14-07:00|info|Vivamus molestie dapibus ligula. Aliquam erat volutpat. Nulla dignissim. Maecenas ornare egestas ligula. Nullam feugiat placerat velit.|mauris erat eget ipsum. Suspendisse sagittis. Nullam vitae diam. Proin dolor. Nulla semper tellus id nunc interdum feugiat. Sed nec metus facilisis lorem tristique aliquet. Phasellus fermentum convallis ligula. Donec luctus aliquet odio. Etiam ligula tortor,
2019-07-02T21:01:45-07:00|warning|nascetur ridiculus mus. Aenean eget magna. Suspendisse tristique neque venenatis lacus. Etiam bibendum fermentum metus. Aenean sed|conubia nostra, per inceptos hymenaeos. Mauris ut quam vel sapien imperdiet ornare. In faucibus. Morbi vehicula. Pellentesque tincidunt tempus risus. Donec egestas. Duis ac arcu.
2019-03-27T23:55:37-07:00|info|purus. Duis elementum, dui quis accumsan convallis, ante lectus convallis est, vitae sodales nisi magna sed|elit. Etiam laoreet, libero et tristique pellentesque, tellus sem mollis dui, in sodales elit erat vitae risus. Duis a mi fringilla mi lacinia mattis. Integer eu lacus. Quisque imperdiet, erat nonummy
2019-08-09T12:08:55-07:00|error|rutrum non, hendrerit id, ante. Nunc mauris sapien, cursus|malesuada malesuada. Integer id magna et ipsum cursus vestibulum. Mauris magna. Duis dignissim tempor arcu. Vestibulum ut eros non enim commodo hendrerit. Donec porttitor tellus non magna. Nam ligula elit, pretium et, rutrum non, hendrerit
2019-08-17T04:03:02-07:00|info|quam. Pellentesque habitant morbi tristique senectus et netus et malesuada fames ac turpis egestas. Aliquam fringilla cursus|et ipsum cursus vestibulum. Mauris magna. Duis dignissim tempor arcu. Vestibulum ut eros non enim commodo hendrerit. Donec porttitor tellus non magna. Nam ligula elit, pretium et, rutrum
2018-11-19T19:47:09-08:00|error|vitae, posuere at, velit. Cras|commodo hendrerit. Donec porttitor tellus non magna. Nam ligula elit, pretium et, rutrum non, hendrerit id, ante. Nunc mauris sapien, cursus in, hendrerit consectetuer, cursus et, magna.
2019-07-17T06:00:13-07:00|error|tellus justo sit amet nulla. Donec non justo. Proin non massa non ante bibendum|bibendum fermentum metus. Aenean sed pede nec ante blandit viverra. Donec tempus, lorem fringilla ornare placerat, orci lacus vestibulum lorem,
2019-10-13T12:33:36-07:00|error|Pellentesque habitant morbi tristique senectus et netus et malesuada fames ac turpis|at augue id ante dictum cursus. Nunc mauris elit, dictum eu, eleifend nec, malesuada ut, sem. Nulla interdum. Curabitur dictum. Phasellus in felis. Nulla tempor augue ac ipsum. Phasellus vitae mauris sit amet lorem semper auctor. Mauris vel turpis. Aliquam adipiscing lobortis risus.
2018-10-30T23:47:55-07:00|error|Maecenas mi felis, adipiscing fringilla, porttitor vulputate, posuere vulputate,|rutrum magna. Cras convallis convallis dolor. Quisque tincidunt pede ac urna. Ut tincidunt vehicula risus. Nulla eget metus eu erat semper rutrum. Fusce dolor quam, elementum at, egestas a, scelerisque sed, sapien. Nunc pulvinar arcu et
2019-03-11T03:19:18-07:00|info|a purus. Duis elementum, dui quis accumsan|vitae semper egestas, urna justo faucibus lectus, a sollicitudin orci sem eget massa. Suspendisse eleifend. Cras sed leo. Cras vehicula aliquet libero. Integer in magna. Phasellus dolor elit, pellentesque a, facilisis non, bibendum sed, est. Nunc laoreet
2019-04-11T17:34:19-07:00|warning|Cras eu tellus eu augue porttitor interdum. Sed|Nam consequat dolor vitae dolor. Donec fringilla. Donec feugiat metus sit amet ante. Vivamus non lorem vitae odio sagittis semper. Nam tempor diam dictum sapien. Aenean massa. Integer vitae nibh. Donec est mauris, rhoncus id, mollis nec, cursus a, enim. Suspendisse aliquet, sem ut cursus luctus, ipsum leo elementum sem,
2019-10-10T02:39:27-07:00|info|egestas rhoncus. Proin nisl sem, consequat nec,|adipiscing, enim mi tempor lorem, eget mollis lectus pede et risus. Quisque libero lacus, varius et, euismod et, commodo at, libero. Morbi accumsan laoreet ipsum. Curabitur consequat, lectus sit amet luctus vulputate, nisi sem semper erat, in consectetuer ipsum
2019-09-09T17:03:19-07:00|info|Proin eget odio. Aliquam vulputate ullamcorper magna. Sed eu eros. Nam consequat dolor vitae dolor. Donec fringilla. Donec feugiat|ligula eu enim. Etiam imperdiet dictum magna. Ut tincidunt orci quis lectus. Nullam suscipit, est ac facilisis facilisis, magna tellus faucibus leo, in lobortis tellus justo
2019-08-03T00:31:25-07:00|info|Nam porttitor scelerisque neque. Nullam nisl. Maecenas malesuada fringilla est. Mauris eu turpis. Nulla|eu enim. Etiam imperdiet dictum magna. Ut tincidunt orci quis lectus. Nullam suscipit, est ac facilisis facilisis, magna tellus faucibus leo, in lobortis tellus justo sit amet nulla. Donec non justo. Proin
2019-09-02T10:15:15-07:00|error|ullamcorper eu, euismod ac, fermentum vel, mauris. Integer sem elit, pharetra|Nam nulla magna, malesuada vel, convallis in, cursus et, eros. Proin ultrices. Duis volutpat nunc sit amet metus. Aliquam erat volutpat. Nulla facilisis. Suspendisse commodo tincidunt nibh. Phasellus nulla. Integer vulputate,
2018-12-29T14:02:30-08:00|info|adipiscing ligula. Aenean gravida nunc sed pede. Cum sociis natoque penatibus et magnis|dolor, nonummy ac, feugiat non, lobortis quis, pede. Suspendisse dui. Fusce diam nunc, ullamcorper eu, euismod ac, fermentum vel, mauris.
2018-07-31T01:36:04-07:00|error|hymenaeos. Mauris ut quam vel sapien imperdiet ornare.|lorem, eget mollis lectus pede et risus. Quisque libero lacus, varius et, euismod et, commodo at, libero. Morbi accumsan laoreet ipsum. Curabitur consequat, lectus sit amet luctus vulputate, nisi
2020-03-12T07:01:38-07:00|warning|Quisque libero lacus, varius et, euismod et, commodo|Morbi neque tellus, imperdiet non, vestibulum nec, euismod in, dolor. Fusce feugiat. Lorem ipsum dolor sit amet, consectetuer adipiscing elit. Aliquam auctor, velit eget laoreet posuere, enim nisl
2018-08-09T18:47:21-07:00|error|neque. Morbi quis urna. Nunc quis arcu vel quam dignissim pharetra.|ornare tortor at risus. Nunc ac sem ut dolor dapibus gravida. Aliquam tincidunt, nunc ac mattis ornare, lectus ante dictum mi, ac mattis velit justo nec ante. Maecenas mi felis, adipiscing fringilla, porttitor vulputate, posuere vulputate, lacus. Cras interdum. Nunc sollicitudin commodo ipsum. Suspendisse non leo. Vivamus nibh dolor,
2019-10-22T20:28:38-07:00|error|ac ipsum. Phasellus vitae mauris sit amet lorem semper auctor. Mauris vel turpis. Aliquam adipiscing lobortis risus. In mi pede,|egestas. Duis ac arcu. Nunc mauris. Morbi non sapien molestie orci tincidunt adipiscing. Mauris molestie pharetra nibh. Aliquam ornare, libero at auctor ullamcorper, nisl arcu iaculis enim, sit amet ornare
2019-11-04T07:14:39-08:00|error|amet massa. Quisque porttitor eros nec tellus. Nunc lectus pede, ultrices|ut, molestie in, tempus eu, ligula. Aenean euismod mauris eu elit. Nulla facilisi. Sed neque. Sed eget lacus. Mauris non dui nec urna suscipit nonummy. Fusce fermentum fermentum arcu. Vestibulum ante ipsum primis in faucibus orci luctus et ultrices posuere cubilia Curae; Phasellus ornare. Fusce mollis. Duis sit
2018-06-10T18:30:09-07:00|info|adipiscing ligula. Aenean gravida nunc sed pede. Cum sociis natoque penatibus et magnis dis parturient montes, nascetur ridiculus mus.|tincidunt orci quis lectus. Nullam suscipit, est ac facilisis facilisis, magna tellus faucibus leo, in lobortis tellus justo sit amet nulla. Donec non justo. Proin non
2018-07-26T20:16:56-07:00|info|sagittis lobortis mauris. Suspendisse aliquet molestie|conubia nostra, per inceptos hymenaeos. Mauris ut quam vel sapien imperdiet ornare. In faucibus. Morbi vehicula. Pellentesque tincidunt tempus risus. Donec egestas. Duis ac arcu. Nunc mauris. Morbi non sapien molestie orci tincidunt adipiscing. Mauris molestie pharetra nibh. Aliquam ornare, libero
2019-03-17T20:58:41-07:00|warning|gravida. Praesent eu nulla at sem molestie sodales. Mauris blandit enim consequat purus. Maecenas libero est,|Suspendisse aliquet, sem ut cursus luctus, ipsum leo elementum sem, vitae aliquam eros turpis non enim. Mauris quis turpis vitae purus gravida sagittis. Duis gravida. Praesent eu nulla at sem molestie
2020-04-22T08:20:23-07:00|info|semper egestas, urna justo faucibus lectus, a sollicitudin orci sem eget massa. Suspendisse eleifend. Cras sed leo. Cras|sed turpis nec mauris blandit mattis. Cras eget nisi dictum augue malesuada malesuada. Integer id magna et ipsum cursus vestibulum. Mauris magna. Duis dignissim tempor arcu. Vestibulum ut eros non enim commodo hendrerit. Donec porttitor tellus non magna. Nam ligula elit, pretium et,
2019-12-30T01:28:34-08:00|error|ac, eleifend vitae, erat. Vivamus nisi. Mauris nulla. Integer urna. Vivamus molestie dapibus ligula. Aliquam erat volutpat.|feugiat placerat velit. Quisque varius. Nam porttitor scelerisque neque. Nullam nisl. Maecenas malesuada fringilla est. Mauris eu turpis. Nulla aliquet. Proin velit. Sed malesuada augue ut lacus. Nulla tincidunt, neque vitae semper egestas, urna justo
2020-03-15T10:38:31-07:00|warning|pede, nonummy ut, molestie in, tempus eu, ligula. Aenean euismod mauris eu elit. Nulla facilisi. Sed neque.|dictum. Proin eget odio. Aliquam vulputate ullamcorper magna. Sed eu eros. Nam consequat dolor vitae dolor. Donec fringilla. Donec feugiat metus sit amet ante. Vivamus non lorem vitae odio
2019-05-24T15:15:50-07:00|info|In ornare sagittis felis. Donec tempor, est ac mattis semper, dui lectus rutrum urna, nec luctus|at auctor ullamcorper, nisl arcu iaculis enim, sit amet ornare lectus justo eu arcu. Morbi sit amet massa. Quisque porttitor eros nec tellus. Nunc
2018-07-13T02:42:54-07:00|info|amet luctus vulputate, nisi sem semper erat, in consectetuer ipsum|imperdiet ornare. In faucibus. Morbi vehicula. Pellentesque tincidunt tempus risus. Donec egestas. Duis ac arcu. Nunc mauris. Morbi non sapien molestie orci tincidunt adipiscing. Mauris molestie pharetra nibh. Aliquam ornare, libero at
2020-03-23T06:47:55-07:00|error|erat, eget tincidunt dui augue|justo sit amet nulla. Donec non justo. Proin non massa non ante bibendum ullamcorper. Duis cursus, diam at pretium aliquet, metus urna convallis erat, eget tincidunt dui augue
2019-07-29T22:29:34-07:00|warning|tristique ac, eleifend vitae, erat. Vivamus nisi. Mauris nulla. Integer urna. Vivamus molestie dapibus ligula. Aliquam erat volutpat.|at, egestas a, scelerisque sed, sapien. Nunc pulvinar arcu et pede. Nunc sed orci lobortis augue scelerisque mollis. Phasellus libero mauris, aliquam eu, accumsan sed, facilisis vitae, orci.
2019-10-05T21:42:29-07:00|warning|tempor lorem, eget mollis lectus pede et|ut, pellentesque eget, dictum placerat, augue. Sed molestie. Sed id risus quis diam luctus lobortis. Class aptent taciti sociosqu ad litora torquent per conubia nostra, per inceptos hymenaeos. Mauris ut quam
2018-08-28T23:55:43-07:00|error|mauris. Suspendisse aliquet molestie tellus. Aenean egestas hendrerit neque. In ornare sagittis felis. Donec tempor, est ac mattis|ipsum nunc id enim. Curabitur massa. Vestibulum accumsan neque et nunc. Quisque ornare tortor at risus. Nunc ac sem ut dolor dapibus gravida. Aliquam tincidunt, nunc ac mattis
2020-01-04T01:22:42-08:00|info|pede. Praesent eu dui. Cum sociis|arcu eu odio tristique pharetra. Quisque ac libero nec ligula consectetuer rhoncus. Nullam velit dui, semper et, lacinia vitae, sodales at, velit. Pellentesque ultricies dignissim lacus. Aliquam rutrum lorem ac risus. Morbi metus. Vivamus euismod urna. Nullam lobortis quam a felis
2018-11-06T13:13:36-08:00|info|at, velit. Pellentesque ultricies dignissim lacus. Aliquam rutrum lorem ac risus.|Nullam feugiat placerat velit. Quisque varius. Nam porttitor scelerisque neque. Nullam nisl. Maecenas malesuada fringilla est. Mauris eu turpis. Nulla aliquet. Proin velit. Sed malesuada augue ut lacus. Nulla tincidunt, neque vitae semper egestas, urna justo faucibus lectus, a sollicitudin orci sem eget massa.
2018-08-15T14:49:44-07:00|error|varius et, euismod et, commodo at, libero. Morbi accumsan laoreet ipsum. Curabitur consequat,|diam. Proin dolor. Nulla semper tellus id nunc interdum feugiat. Sed nec metus facilisis lorem tristique aliquet. Phasellus fermentum convallis ligula. Donec luctus aliquet
2019-04-06T19:04:49-07:00|error|tellus non magna. Nam ligula elit, pretium|neque pellentesque massa lobortis ultrices. Vivamus rhoncus. Donec est. Nunc ullamcorper, velit in aliquet lobortis, nisi nibh lacinia orci, consectetuer euismod est arcu ac orci. Ut semper pretium neque. Morbi quis urna.
2020-04-10T10:12:31-07:00|warning|risus. Donec egestas. Aliquam nec|arcu. Aliquam ultrices iaculis odio. Nam interdum enim non nisi. Aenean eget metus. In nec orci. Donec nibh. Quisque nonummy ipsum non arcu. Vivamus sit amet risus. Donec egestas. Aliquam nec enim. Nunc ut erat. Sed nunc est, mollis non, cursus non, egestas a, dui. Cras
2020-04-20T00:23:03-07:00|warning|risus. Duis a mi fringilla mi lacinia mattis. Integer eu lacus. Quisque|quis lectus. Nullam suscipit, est ac facilisis facilisis, magna tellus faucibus leo, in lobortis tellus justo sit amet nulla. Donec non justo. Proin non massa non ante bibendum ullamcorper.
2019-11-01T07:40:49-07:00|info|eu, eleifend nec, malesuada ut, sem. Nulla interdum. Curabitur dictum. Phasellus in felis. Nulla tempor augue ac ipsum. Phasellus|montes, nascetur ridiculus mus. Proin vel nisl. Quisque fringilla euismod enim. Etiam gravida molestie arcu. Sed eu nibh vulputate mauris sagittis placerat. Cras dictum ultricies ligula. Nullam enim. Sed nulla ante, iaculis nec, eleifend non, dapibus rutrum, justo. Praesent
2020-02-16T22:34:06-08:00|error|rutrum lorem ac risus. Morbi|non, vestibulum nec, euismod in, dolor. Fusce feugiat. Lorem ipsum dolor sit amet, consectetuer adipiscing elit. Aliquam auctor, velit eget laoreet posuere, enim nisl elementum purus,
2018-11-30T08:55:21-08:00|error|nulla. Donec non justo. Proin non massa non ante bibendum ullamcorper. Duis cursus, diam at pretium aliquet, metus urna|sem magna nec quam. Curabitur vel lectus. Cum sociis natoque penatibus et magnis dis parturient montes, nascetur ridiculus mus. Donec dignissim magna a tortor.
2018-09-19T10:40:02-07:00|warning|Ut tincidunt orci quis lectus. Nullam suscipit, est ac facilisis facilisis, magna tellus faucibus leo,|nunc sed libero. Proin sed turpis nec mauris blandit mattis. Cras eget nisi dictum augue malesuada malesuada. Integer id magna et ipsum cursus vestibulum. Mauris magna. Duis
2018-12-19T13:57:50-08:00|info|sit amet luctus vulputate, nisi sem|id magna et ipsum cursus vestibulum. Mauris magna. Duis dignissim tempor arcu. Vestibulum ut eros non enim commodo hendrerit. Donec porttitor tellus non magna. Nam ligula elit, pretium et, rutrum non, hendrerit id, ante. Nunc
2018-11-15T15:29:21-08:00|warning|vestibulum. Mauris magna. Duis dignissim tempor arcu. Vestibulum ut eros non|vel lectus. Cum sociis natoque penatibus et magnis dis parturient montes, nascetur ridiculus mus. Donec dignissim magna a tortor. Nunc commodo auctor velit. Aliquam nisl. Nulla eu neque pellentesque massa lobortis
2020-02-03T02:07:37-08:00|error|ornare lectus justo eu arcu. Morbi sit amet massa. Quisque porttitor eros nec tellus.|eu, ultrices sit amet, risus. Donec nibh enim, gravida sit amet, dapibus id, blandit at, nisi. Cum sociis natoque penatibus et magnis dis parturient montes, nascetur
2019-04-11T09:51:51-07:00|error|Donec felis orci, adipiscing non, luctus sit amet, faucibus ut, nulla. Cras eu tellus eu augue|nunc. In at pede. Cras vulputate velit eu sem. Pellentesque ut ipsum ac mi eleifend egestas. Sed pharetra, felis eget varius ultrices, mauris ipsum porta elit, a feugiat tellus lorem eu metus. In lorem. Donec elementum, lorem ut aliquam iaculis, lacus pede sagittis augue,
2019-10-30T09:58:14-07:00|error|amet risus. Donec egestas. Aliquam nec enim. Nunc ut erat. Sed|nisi a odio semper cursus. Integer mollis. Integer tincidunt aliquam arcu. Aliquam ultrices iaculis odio. Nam interdum enim non nisi. Aenean eget metus. In nec orci. Donec
2018-12-11T04:44:30-08:00|error|nulla ante, iaculis nec, eleifend|ac mattis velit justo nec ante. Maecenas mi felis, adipiscing fringilla, porttitor vulputate, posuere vulputate, lacus. Cras interdum. Nunc sollicitudin commodo ipsum. Suspendisse non leo. Vivamus nibh dolor, nonummy ac, feugiat non,
2019-09-29T17:13:42-07:00|warning|elit. Etiam laoreet, libero et tristique pellentesque, tellus sem mollis dui, in|Nullam suscipit, est ac facilisis facilisis, magna tellus faucibus leo, in lobortis tellus justo sit amet nulla. Donec non justo. Proin non massa non ante bibendum ullamcorper. Duis cursus, diam at pretium aliquet, metus urna convallis erat, eget tincidunt dui augue eu tellus. Phasellus elit
2019-03-31T04:42:41-07:00|info|varius et, euismod et, commodo at, libero. Morbi accumsan laoreet|quam. Pellentesque habitant morbi tristique senectus et netus et malesuada fames ac turpis egestas. Aliquam fringilla cursus purus. Nullam scelerisque neque sed sem egestas blandit. Nam nulla magna, malesuada vel, convallis in, cursus et, eros. Proin ultrices. Duis volutpat nunc sit amet metus. Aliquam erat volutpat. Nulla facilisis. Suspendisse
2019-06-18T09:12:11-07:00|warning|diam. Proin dolor. Nulla semper tellus id nunc interdum feugiat. Sed|porttitor eros nec tellus. Nunc lectus pede, ultrices a, auctor non, feugiat nec, diam. Duis mi enim, condimentum eget, volutpat ornare, facilisis eget, ipsum. Donec sollicitudin adipiscing ligula. Aenean gravida nunc sed pede. Cum sociis natoque penatibus et magnis dis parturient montes, nascetur ridiculus mus. Proin
2019-11-25T21:54:58-08:00|error|eu enim. Etiam imperdiet dictum magna. Ut tincidunt orci quis lectus. Nullam suscipit, est ac facilisis facilisis, magna tellus|rutrum urna, nec luctus felis purus ac tellus. Suspendisse sed dolor. Fusce mi lorem, vehicula et, rutrum eu, ultrices sit
2019-12-01T19:36:00-08:00|error|ornare, facilisis eget, ipsum. Donec|ornare tortor at risus. Nunc ac sem ut dolor dapibus gravida. Aliquam tincidunt, nunc ac mattis ornare, lectus ante dictum mi, ac mattis velit justo
2020-01-31T04:48:37-08:00|warning|magna. Nam ligula elit, pretium et, rutrum non, hendrerit id, ante. Nunc|tempus scelerisque, lorem ipsum sodales purus, in molestie tortor nibh sit amet orci. Ut sagittis lobortis mauris. Suspendisse aliquet molestie tellus. Aenean egestas hendrerit neque. In ornare sagittis felis. Donec tempor, est ac mattis semper, dui lectus rutrum urna, nec luctus felis purus ac tellus. Suspendisse sed
2020-04-05T15:15:11-07:00|warning|Suspendisse dui. Fusce diam nunc, ullamcorper eu, euismod ac, fermentum vel, mauris. Integer sem elit, pharetra ut,|non, sollicitudin a, malesuada id, erat. Etiam vestibulum massa rutrum magna. Cras convallis convallis dolor. Quisque tincidunt pede ac urna. Ut tincidunt vehicula risus. Nulla eget
2019-12-09T06:14:49-08:00|warning|gravida non, sollicitudin a, malesuada id, erat. Etiam vestibulum massa rutrum magna. Cras convallis convallis dolor. Quisque|ornare placerat, orci lacus vestibulum lorem, sit amet ultricies sem magna nec quam. Curabitur vel lectus. Cum sociis natoque penatibus et magnis dis parturient montes, nascetur ridiculus mus. Donec dignissim magna a tortor. Nunc commodo auctor velit. Aliquam nisl. Nulla eu neque pellentesque massa lobortis ultrices. Vivamus rhoncus. Donec
2019-11-06T04:28:35-08:00|error|vel sapien imperdiet ornare. In faucibus. Morbi vehicula. Pellentesque tincidunt tempus risus. Donec egestas. Duis ac arcu. Nunc mauris. Morbi|Praesent eu dui. Cum sociis natoque penatibus et magnis dis parturient montes, nascetur ridiculus mus. Aenean eget magna. Suspendisse tristique neque venenatis lacus. Etiam bibendum fermentum metus. Aenean sed pede nec ante blandit viverra. Donec tempus, lorem fringilla ornare placerat,
2018-07-01T04:28:38-07:00|error|Vestibulum ante ipsum primis in|Vivamus nisi. Mauris nulla. Integer urna. Vivamus molestie dapibus ligula. Aliquam erat volutpat. Nulla dignissim. Maecenas ornare egestas ligula. Nullam feugiat
2018-12-12T10:06:47-08:00|warning|vitae velit egestas lacinia. Sed congue, elit sed consequat auctor, nunc nulla vulputate dui,|tellus sem mollis dui, in sodales elit erat vitae risus. Duis a mi fringilla mi lacinia mattis. Integer eu lacus. Quisque imperdiet, erat nonummy ultricies
2019-02-07T19:40:59-08:00|error|enim non nisi. Aenean eget metus. In nec orci. Donec nibh. Quisque nonummy ipsum non arcu. Vivamus sit amet risus.|velit. Cras lorem lorem, luctus ut, pellentesque eget, dictum placerat, augue. Sed molestie. Sed id risus quis diam luctus lobortis. Class aptent taciti sociosqu ad litora torquent per conubia
2019-07-31T13:14:16-07:00|warning|eu enim. Etiam imperdiet dictum magna. Ut tincidunt orci quis lectus. Nullam suscipit, est|fames ac turpis egestas. Aliquam fringilla cursus purus. Nullam scelerisque neque sed sem egestas blandit. Nam nulla magna, malesuada vel, convallis in, cursus et, eros. Proin ultrices. Duis volutpat nunc sit amet metus. Aliquam erat volutpat. Nulla facilisis. Suspendisse commodo tincidunt nibh.
2019-07-02T11:44:47-07:00|error|In nec orci. Donec nibh. Quisque nonummy ipsum non arcu. Vivamus sit amet risus. Donec egestas. Aliquam nec enim.|eu erat semper rutrum. Fusce dolor quam, elementum at, egestas a, scelerisque sed, sapien. Nunc pulvinar arcu et pede. Nunc sed orci lobortis augue scelerisque
2019-03-30T00:06:16-07:00|info|Mauris quis turpis vitae purus gravida sagittis. Duis gravida. Praesent eu|faucibus lectus, a sollicitudin orci sem eget massa. Suspendisse eleifend. Cras sed leo. Cras vehicula aliquet libero. Integer in magna. Phasellus dolor elit,
2018-05-27T23:08:25-07:00|info|rutrum lorem ac risus. Morbi metus. Vivamus euismod|Proin ultrices. Duis volutpat nunc sit amet metus. Aliquam erat volutpat. Nulla facilisis. Suspendisse commodo tincidunt nibh. Phasellus nulla. Integer vulputate, risus
2019-08-06T12:32:02-07:00|warning|nibh lacinia orci, consectetuer euismod est arcu ac orci. Ut|Aliquam ultrices iaculis odio. Nam interdum enim non nisi. Aenean eget metus. In nec orci. Donec nibh. Quisque nonummy ipsum non arcu. Vivamus sit amet risus. Donec egestas. Aliquam nec enim. Nunc ut
